"","Article.ID","Statement.ID","Stat.ID","Journal.ID","Reference","Link","Type.of.statistics","t","N1","N2","p","Page.number","Associated.statistics","Negative.statement","Category"
"31",28,1,1,2,"Duffy, K. A., & Chartrand, T. L. (2015). The Extravert Advantage: How and When Extraverts Build Rapport With Other People. Psychological Science, 26(11), 17951802. http://doi.org/10.1177/0956797615600890
","http://pss.sagepub.com/content/26/11/1795.abstract","Bayesian analysis",NA,NA,NA,NA,NA,NA,"In Study 1, we found that extraversion predicted increased mimicry when an affiliation goal was present, but not when an affiliation goal was absent. [...] Furthermore, our studies show that this skillfulness of extraverts emerges only when they are motivated to affiliate, providing evidence in favor of the reward-sensitivity as-core model of extraversion.","Bayesian-analysis"
"32",29,1,1,1,"Dunabeitia, J. A., & Costa, A. (2015). Lying in a native and foreign language. Psychonomic Bulletin & Review, 22(4), 11241129.","http://link.springer.com/article/10.3758/s13423-014-0781-4","ANOVA",NA,NA,NA,NA,"1127","Crucially, the interaction between these two factors was not significant [F < 1, p > 0.92, partial<U+03B7>2 < 0.01, 1-ß < 0.06], showing that the effect of deception was highly similar in the native and foreign language (2.68 % and 2.64 % increase, respectively).","Importantly, these two effects did not interact, suggesting that the processing cost associated with deception is similar in a native and foreign language.","Incorrect-frequentist  whole population"
"33",30,1,1,2,"Durso, G. R. O., Luttrell, A., & Way, B. M. (2015). Over-the-Counter Relief From Pains and Pleasures Alike: Acetaminophen Blunts Evaluation Sensitivity to Both Negative and Positive Stimuli. Psychological Science, 26(6), 750758. http://doi.org/10.1177/0956797615570366
","http://pss.sagepub.com/content/26/6/750.abstract","Independent Samples T-Test","0.33",37,42,"0.744","6","We first submitted participants’ overall blue ratings to all stimuli to an independent-samples t test, with treatment as the between-participants factor. This analysis yielded a nonsignificant result, t(77) = 0.33, p = .744. Specifically, participants who took acetaminophen did not significantly differ in their blueness ratings of stimuli overall (M = 3.45, SD = 0.98) compared with participants who received a placebo (M = 3.38, SD = 0.83).","Participants in the acetaminophen condition also rated both negative and positive stimuli as less emotionally arousing than did participants in the placebo condition (Studies 1 and 2), whereas nonevaluative ratings (extent of color saturation in each image; Study 2) were not affected by drug condition.","Incorrect-frequentist  current sample"
"34",31,1,1,2,"Engelhardt, C. R., Mazurek, M. O., Hilgard, J., Rouder, J. N., & Bartholow, B. D. (2015). Effects of Violent-Video-Game Exposure on Aggressive Behavior, Aggressive-Thought Accessibility, and Aggressive Affect Among Adults With and Without Autism Spectrum Disorder. Psychological Science, 26(8), 11871200. http://doi.org/10.1177/0956797615583038
","http://pss.sagepub.com/content/26/8/1187.abstract","Bayesian analysis",NA,NA,NA,NA,NA,NA,"Results showed strong evidence that adults with ASD, compared with typically developing adults, are not differentially affected by acute exposure to violent video games. Moreover, model comparisons provided modest evidence against any effect of violent game content whatsoever. Findings from this experiment suggest that societal concerns that exposure to violent games may have a unique effect on adults with autism are not supported by evidence.","Bayesian-analysis"
"35",32,1,1,3,"Evans, A. M., Dillon, K. D., & Rand, D. G. (2015). Fast but not intuitive, slow but not reflective: Decision conflict drives reaction times in social dilemmas. Journal of Experimental Psychology: General, 144(5), 951966. doi:10.1037/xge0000107","http://psycnet.apa.org/journals/xge/144/5/951/","T-Test for slopes",NA,NA,NA,"0.58","959","Time pressure significantly increased cooperation (b =.035, SE =.0094, p =.001), but had no significant effect on decision extremity (b =.002, SE = .0054, p =.58).","Experimentally promoting reliance on intuition increases cooperation, but has no effects on decision extremity or feelings of conflictedness.","Incorrect-frequentist  whole population"
"36",32,1,2,3,"Evans, A. M., Dillon, K. D., & Rand, D. G. (2015). Fast but not intuitive, slow but not reflective: Decision conflict drives reaction times in social dilemmas. Journal of Experimental Psychology: General, 144(5), 951966. doi:10.1037/xge0000107","http://psycnet.apa.org/journals/xge/144/5/951/","Independent Samples T-Test","0.298",436,428,"0.76","960","Decisions in the two pro-intuition conditions were not significantly more extreme (M=.68, SD=.40) than decisions in the pro-reflection conditions (M=.67, SD=.38), t(862)=.298, p=.76, d= .02","Experimentally promoting reliance on intuition increases cooperation, but has no effects on decision extremity or feelings of conflictedness.","Incorrect-frequentist  whole population"
"37",32,1,3,3,"Evans, A. M., Dillon, K. D., & Rand, D. G. (2015). Fast but not intuitive, slow but not reflective: Decision conflict drives reaction times in social dilemmas. Journal of Experimental Psychology: General, 144(5), 951966. doi:10.1037/xge0000107","http://psycnet.apa.org/journals/xge/144/5/951/","Independent Samples T-Test","1.27",436,428,"0.21","960","Levels of conflict were similar in the two pro-intuition (M=4.79, SD=2.90) and two pro-reflection (M=4.54, SD=2.87) conditions, t(862)=1.27, p=.21, d=.08.","Experimentally promoting reliance on intuition increases cooperation, but has no effects on decision extremity or feelings of conflictedness.","Incorrect-frequentist  whole population"
"38",33,1,1,2,"Fan, S. P., Liberman, Z., Keysar, B., & Kinzler, K. D. (2015). The Exposure Advantage: Early Exposure to a Multilingual Environment Promotes Effective Communication. Psychological Science, 26(7), 10901097. http://doi.org/10.1177/0956797615574699
","pss.sagepub.com/content/26/7/1090.abstract","Independent Samples T-Test","0.072",24,24,"0.94","4","Children in the bilingual and exposure groups were significantly more likely than children in the monolingual group to move the target, t(46) = 2.81, p = .007, d = 0.83, and t(46) = 2.51, p = .016, d = 0.74, respectively, whereas the performance of the bilingual and exposure groups did not differ, t(46) = 0.072, p = .94, d = 0.02.","Children who were merely exposed to a second language performed as well as bilingual children, despite having lower executive-function scores. Thus, the communicative advantages demonstrated by the bilinguals may be social in origin, and not due to enhanced executive control.","Incorrect-frequentist  whole population"
"39",34,1,1,2,"Farooqui, A. A., & Manly, T. (2015). Anticipatory control through associative learning of subliminal relations invisible may be better than visible. Psychological Science, 0956797614564191.","http://pss.sagepub.com/content/26/3/325.abstract","ANOVA",NA,NA,NA,NA,"331","In Experiments 7 and 8, unlike Experiments 1 and 2, performance did not differ on switch trials preceded by the predictive cue compared with those preceded by the nonpredictive cue (p > .35).","This utilization of subliminal information was flexible and adapted to a change in cues predicting task switches and occurred only when switch trials were difficult and effortful.","Incorrect-frequentist  current sample"
"40",35,1,1,2,"FeldmanHall, O., Raio, C. M., Kubota, J. T., Seiler, M. G., & Phelps, E. A. (2015). The Effects of Social Context and Acute Stress on Decision Making Under Uncertainty. Psychological Science, 26(12), 19181926. http://doi.org/10.1177/0956797615605807","http://pss.sagepub.com/content/26/12/1918.abstract","Paired Samples T-Test","0.25",28,NA,"0.8","1922","Subjects in the control condition spent approximately the same amount of money irrespective of whether they were gambling (lottery game: M = $3.74, SD = 2.40) or entrusting money to a partner (trust game: M = $3.81, SD = 2.1), t(27) = -0.25, p = .80 (paired-samples t test), behaving consistently overall irrespective of context...","Those who were not under stress exhibited no differences between the amount of money gambled and the amount of money entrusted to partners.","Incorrect-frequentist  current sample"
"41",36,1,1,1,"Fenn, K. M., & Hambrick, D. Z. (2015). General intelligence predicts memory change across sleep. Psychonomic Bulletin & Review, 22(3), 791799.","http://link.springer.com/article/10.3758/s13423-014-0731-1","Correlation",NA,NA,NA,"0.37","795","As predicted, memory gain and memory loss correlated near zero with g in the wake group (r = .06, p = .37 and r = -.02, p = . 79 with gain and loss, respectively).","In the wake group, g was not correlated with either memory gain or memory loss.","Incorrect-frequentist  current sample"
"42",37,1,1,3,"Ford, B. Q., Dmitrieva, J. O., Heller, D., Chentsova-Dutton, Y., Grossmann, I., Tamir, M., … Mauss, I. B. (2015). Culture shapes whether the pursuit of happiness predicts higher or lower well-being. Journal of Experimental Psychology: General, 144(6), 10531062. doi:10.1037/xge0000108","http://psycnet.apa.org/journals/xge/144/6/1053/","Correlation",NA,NA,NA,"0.485","1058","Although negative in direction, motivation to pursue happiness was not significantly associated with well-being in Germany, r=-.11, p=.485, CI.95: -.40, .19.","Motivation to pursue happiness predicted lower well-being in the United States, did not predict well-being in Germany, and predicted higher well-being in Russia and in East Asia.","Incorrect-frequentist  current sample"
"43",38,1,1,3,"Foroughi, C. K., Werner, N. E., Barragán, D., & Boehm-Davis, D. A. (2015). Interruptions disrupt reading comprehension. Journal of Experimental Psychology: General, 144(3), 704.","http://psycnet.apa.org/journals/xge/144/3/704.pdf&productCode=pa&uid=2015-15250-001","Post-hoc T-Test",NA,NA,NA,NA,"707","Tests of simple main effects within recognition questions showed no significant difference between the interruption (M = 6.46, SD = 1.28, 95% Cl [5.92,7.00]) and no-interruption conditions (M = 6.50, SD = 1.14, 95% Cl [6.01, 6.98]), p > .249.","In Experiment 2, interruptions disrupted reading comprehension but not recognition of information from the text.","Incorrect-frequentist  current sample"
"44",39,1,1,3,"Forstmann, M., & Burgmer, P. (2015). Adults are intuitive mind-body dualists. Journal of Experimental Psychology: General, 144(1), 222235. https://doi.org/10.1037/xge0000045
","http://psycnet.apa.org/journals/xge/144/1/222/","ANOVA",NA,NA,NA,"0.946","228","In line with our reasoning, no significant Robot X Dimension interaction emerged, F(1, 54) = 0.01, p = .946.","Over 8 studies, using various thought experiment paradigms, participants reliably ascribed to a physically duplicated being a greater retention of physical than of mental properties. This difference was unrelated to whether or not this being was given a proper name (Study 1b) and was only found for entities that were considered to actually possess a mind (Study 1c).","Incorrect-frequentist  current sample"
"45",39,1,2,3,"Forstmann, M., & Burgmer, P. (2015). Adults are intuitive mind-body dualists. Journal of Experimental Psychology: General, 144(1), 222235. https://doi.org/10.1037/xge0000045
","http://psycnet.apa.org/journals/xge/144/1/222/","Paired Samples T-Test","0.07",55,NA,".944","228","More precisely, differences between ascribed computational and physical properties were not significantly different between original (M = 0.38, SD = 0.84) and duplicate robot (M = 0.39, SD = 0.96), t(54) = 0.07, p > .9.","Over 8 studies, using various thought experiment paradigms, participants reliably ascribed to a physically duplicated being a greater retention of physical than of mental properties. This difference was unrelated to whether or not this being was given a proper name (Study 1b) and was only found for entities that were considered to actually possess a mind (Study 1c).","Incorrect-frequentist  current sample"
"46",39,1,3,3,"Forstmann, M., & Burgmer, P. (2015). Adults are intuitive mind-body dualists. Journal of Experimental Psychology: General, 144(1), 222235. https://doi.org/10.1037/xge0000045
","http://psycnet.apa.org/journals/xge/144/1/222/","Paired Samples T-Test","0.23",55,NA,".819","228","Further, there was no difference between ascriptions of retained computational (M = 6.33, SD = 1.08) versus physical attributes (M = 6.31, SD = 1.00) for the original robot, t(54) = 0.23, p > .8, and likewise no difference between ascriptions of retained computational (M = 5.94, SD = 1.38) versus physical attributes (M = 5.93, SD = 1.31) for the duplicate robot, t(54) = 0.07, p > .9.","Over 8 studies, using various thought experiment paradigms, participants reliably ascribed to a physically duplicated being a greater retention of physical than of mental properties. This difference was unrelated to whether or not this being was given a proper name (Study 1b) and was only found for entities that were considered to actually possess a mind (Study 1c).","Incorrect-frequentist  current sample"
"47",39,1,4,3,"Forstmann, M., & Burgmer, P. (2015). Adults are intuitive mind-body dualists. Journal of Experimental Psychology: General, 144(1), 222235. https://doi.org/10.1037/xge0000045
","http://psycnet.apa.org/journals/xge/144/1/222/","Paired Samples T-Test","0.07",55,NA,".944","228","Further, there was no difference between ascriptions of retained computational (M = 6.33, SD = 1.08) versus physical attributes (M = 6.31, SD = 1.00) for the original robot, t(54) = 0.23, p > .8, and likewise no difference between ascriptions of retained computational (M = 5.94, SD = 1.38) versus physical attributes (M = 5.93, SD = 1.31) for the duplicate robot, t(54) = 0.07, p > .9.","Over 8 studies, using various thought experiment paradigms, participants reliably ascribed to a physically duplicated being a greater retention of physical than of mental properties. This difference was unrelated to whether or not this being was given a proper name (Study 1b) and was only found for entities that were considered to actually possess a mind (Study 1c).","Incorrect-frequentist  current sample"
"48",40,1,1,1,"Freud, E., Avidan, G., & Ganel, T. (2014). The highs and lows of object impossibility: effects of spatial frequency on holistic processing of impossible objects. Psychonomic Bulletin & Review, 22(1), 297306. https://doi.org/10.3758/s13423-014-0678-2
","http://link.springer.com/article/10.3758/s13423-014-0678-2","ANOVA",NA,NA,NA,"0.23","301","A repeated measures analysis of variance (ANOVA) revealed a significant three-way interaction between object type, frequency, and block [F(1, 29) = 5.9, MSE = 2733, <U+03B7>p2 = .17, p < .05]. Particularly, Garner interference was found in the LSF condition for both possible (29 ms) [F(1, 29) = 7.29, p < .05] and impossible (47 ms) [F(1, 29) = 15.4, p < .001] objects, and planned comparison revealed no differences in Garner interference between the two object types [F(1, 29) = 1.4, p = .23].","For images containing only LSF, similar interference effects were observed for possible and impossible objects, indicating that the two object categories were processed in a holistic manner. In contrast, for the HSF images, Garner interference was obtained only for possible, but not for impossible objects. Importantly, we provided evidence to show that this effect could not be attributed to a lack of sensitivity to object possibility in the LSF images.","Correct-frequentist"
"49",41,1,1,2,"Gino, F., Kouchaki, M., & Galinsky, A. D. (2015). The Moral Virtue of Authenticity: How Inauthenticity Produces Feelings of Immorality and Impurity. Psychological Science, 26(7), 983996. http://doi.org/10.1177/0956797615575277
","http://pss.sagepub.com/content/26/7/983.abstract","Wald test",NA,NA,NA,"0.2","8","When feelings of impurity and psychological discomfort were included in the equation (in addition to the dummies for the failure condition and the inauthenticity condition), the effect of inauthenticity on helping was reduced (from b = -0.97, SE = 0.35, Wald = 7.63, p = .006, to b = 0.37, SE<U+2009>= 0.49, Wald = 0.57, p = .45). Feelings of impurity predicted helping (b = 0.38, SE = 0.11, Wald = 12.25, p < .001), but psychological discomfort did not (b = 0.14, SE<U+2009>= 0.11, Wald = 1.67, p = .20).","The observed effects on desire for cleansing were not driven by general negative experiences (i.e., failing a test) but were unique to experiences of inauthenticity.","Incorrect-frequentist  current sample"
"50",42,1,1,3,"Glick, D. M., & Orsillo, S. M. (2015). An investigation of the efficacy of acceptance-based behavioral therapy for academic procrastination. Journal of Experimental Psychology: General, 144(2), 400409. https://doi.org/10.1037/xge0000050
","http://psycnet.apa.org/journals/xge/144/2/400/","Independent Samples T-Test","0.06",69,49,"0.95","405","However, there were no differences between the TM condition (M=2.77, SD=4.84) and the ABBT condition (M=2.72, SD=4.34; t=.06, p=.95, d=.01) on the Ideal/Actual ratio constructed to measure behavioral procrastination.","Although a trend suggested that time management intervention participants completed more reading, no group differences in procrastination were revealed.","Correct-frequentist"
"51",43,1,1,1,"Godwin, H. J., Menneer, T., Cave, K. R., Thaibsyah, M., & Donnelly, N. (2014). The effects of increasing target prevalence on information processing during visual search. Psychonomic Bulletin & Review, 22(2), 469475. https://doi.org/10.3758/s13423-014-0686-2
","http://link.springer.com/article/10.3758/s13423-014-0686-2","ANOVA",NA,NA,NA,"0.2","472","The ANOVA for this measure did not reach significance [F(2, 27)=1.67, p=.2, ges = .1].","Increased prevalence primarily influenced search by increasing the time spent examining objects in the display, rather than by increasing the proportion of objects examined in each display.","Incorrect-frequentist  current sample"
"52",44,1,1,1,"Gollan, T. H., Starr, J., & Ferreira, V. S. (2014). More than use it or lose it: The number-of-speakers effect on heritage language proficiency. Psychonomic Bulletin & Review, 22(1), 147155. https://doi.org/10.3758/s13423-014-0649-7
","http://link.springer.com/article/10.3758/s13423-014-0649-7","T-Test for slopes",NA,NA,NA,"0.18","151","Surprisingly, frequency of English use in childhood did not explain unique variance, ß = -.14, p = .18 (although frequency was significant when we included all of the same predictors except for the primary caregiver’s English proficiency, ß = -.25, p = .03).","HL picture-naming ability correlated positively with the number of different HL speakers participants spoke to as children, independently of each language’s frequency of use, and without negatively affecting English picture-naming ability.","Incorrect-frequentist  current sample"
"53",45,1,1,3,"Gomes, C. M., & McCullough, M. E. (2015). The effects of implicit religious primes on dictator game allocations: A preregistered replication experiment. Journal of Experimental Psychology: General, 144(6), e94e104. doi:10.1037/xge0000027","http://psycnet.apa.org/journals/xge/144/6/e94/","Independent Samples T-Test","0.63",108,108,"0.53","e99","T test analyses showed that the differences between the control condition and the two religious conditions, and between the SRP condition and the ERP condition, were not statistically significant (control vs. SRP: t(214)=0.63, p=.53, mean difference (MD) $0.21, 95% CI [$0.45, $0.88], g=0.059; control versus ERP: t(228)=0.58,p=.56, MD=0.21, 95% CI [$0.91, $0.49], g=0.058); SRP versus ERP: t(193)=1.17,p=.24, MD=0.42, 95% CI [$1.13, $0.29], g=0.11).","We did not find a statistically significant effect for religious priming.","Correct-frequentist"
"54",45,1,2,3,"Gomes, C. M., & McCullough, M. E. (2015). The effects of implicit religious primes on dictator game allocations: A preregistered replication experiment. Journal of Experimental Psychology: General, 144(6), e94e104. doi:10.1037/xge0000027","http://psycnet.apa.org/journals/xge/144/6/e94/","Independent Samples T-Test","0.58",115,115,"0.56","e99","Ttest analyses showed that the differences between the control condition and the two religious conditions, and between the SRP condition and the ERP condition, were not statistically significant (control vs. SRP: t(214)=0.63, p=.53, mean difference (MD) $0.21, 95% CI [$0.45, $0.88], g=0.059; control versus ERP: t(228)=0.58,p=.56, MD=0.21, 95% CI [$0.91, $0.49], g=0.058); SRP versus ERP: t(193)=1.17,p=.24, MD=0.42, 95% CI [$1.13, $0.29], g=0.11).","We did not find a statistically significant effect for religious priming.","Correct-frequentist"
"55",45,1,3,3,"Gomes, C. M., & McCullough, M. E. (2015). The effects of implicit religious primes on dictator game allocations: A preregistered replication experiment. Journal of Experimental Psychology: General, 144(6), e94e104. doi:10.1037/xge0000027","http://psycnet.apa.org/journals/xge/144/6/e94/","Independent Samples T-Test","1.17",97,98,"0.24","e99","Ttest analyses showed that the differences between the control condition and the two religious conditions, and between the SRP condition and the ERP condition, were not statistically significant (control vs. SRP: t(214)=0.63, p=.53, mean difference (MD) $0.21, 95% CI [$0.45, $0.88], g=0.059; control versus ERP: t(228)=0.58,p=.56, MD=0.21, 95% CI [$0.91, $0.49], g=0.058); SRP versus ERP: t(193)=1.17,p=.24, MD=0.42, 95% CI [$1.13, $0.29], g=0.11).","We did not find a statistically significant effect for religious priming.","Correct-frequentist"
"56",46,1,1,2,"Grant, K.-A., Sandman, C. A., Wing, D. A., Dmitrieva, J., & Davis, E. P. (2015). Prenatal Programming of Postnatal Susceptibility to Memory Impairments: A Developmental Double Jeopardy. Psychological Science, 26(7), 10541062. http://doi.org/10.1177/0956797615580299
","http://pss.sagepub.com/content/26/7/1054.abstract","T-Test for slopes",NA,NA,NA,NA,"5","A significant main effect of glucocorticoid treatment was not present for general cognitive ability, expressive language, or memory (see Table 3; ps<U+2009>> .10).","General intellectual functioning and expressive language were not affected by fetal glucocorticoid exposure.","Incorrect-frequentist  current sample"
"57",47,1,1,1,"Gray, R., & Canal-Bruland, R. (2015). Attentional focus, perceived target size, and movement kinematics under performance pressure. Psychonomic Bulletin & Review, 22(6), 16921700. doi:10.3758/s13423-015-0838-z","http://link.springer.com/article/10.3758/s13423-015-0838-z","Post-hoc T-Test",NA,NA,NA,NA,"1697","All other comparisons were not significant. (3x)","There were no significant changes in any of these variables for the Clutch group.","Correct-frequentist"
"58",48,1,1,1,"Gunseli, E., van Moorselaar, D., Meeter, M., & Olivers, C. N. L. (2015). The reliability of retro-cues determines the fate of noncued visual working memory representations. Psychonomic Bulletin & Review, 22(5), 13341341. doi:10.3758/s13423-014-0796-x","http://link.springer.com/article/10.3758/s13423-014-0796-x","Planned Comparision T-Test",NA,NA,NA,"0.58","1337","Planned comparisons showed that both the validity benefit (i.e., the difference between valid and neutral trials), t(19) = 2.32, p=.032, and the invalidity cost was significant for the 80 %-valid condition, t(19) = 4.67, p < .001, but not for the 50 %-valid condition, t(19) = 0.56, p = .580.","Reconciling previous contradictory findings, benefits for valid cues were observed in all conditions, but invalid cueing costs were found only when the retro-cue had a high reliability (i.e., was 80 % valid), but not when it had a lower reliability (i.e., 50 % valid).","Incorrect-frequentist  current sample"
"59",49,1,1,3,"Haberman, J., Brady, T. F., & Alvarez, G. A. (2015). Individual differences in ensemble perception reveal multiple, independent levels of ensemble representation. Journal of Experimental Psychology: General, 144(2), 432446. https://doi.org/10.1037/xge0000053
","http://psycnet.apa.org/journals/xge/144/2/432/","Correlation",NA,NA,NA,"0.72","436","In contrast, the top panel of Figure 3 shows that the correlations across feature domains (orientation task to face task) were weak both for individual judgments (individual orientation vs. individual face, r = .04, p = .81; 95% Cl [—0.25, 0.31]), and for ensemble judgments (ensemble orientation vs. ensemble face, r = .05, p = .72; 95% Cl [-0.23, 0.34]).","High-level ensemble representations (e.g., average facial expression) showed complete independence from low-level ensemble representations (e.g., average orientation).","Incorrect-frequentist  current sample"
"60",50,1,1,1,"Hale, R. G., Brown, J. M., McDunn, B. A., & Siddiqui, A. P. (2015). An influence of extremal edges on boundary extension. Psychonomic Bulletin & Review, 22(4), 961966.","http://link.springer.com/article/10.3758/s13423-014-0751-x","Paired Samples T-Test","0.61",54,NA,"0.272234","964","Finally, for the 40 % size change condition with extremal edges, CC (.341) was significantly less than zero, t(53) = 6.13, p < .001; WW (.289) was again significantly greater than zero, t(53) = 5.17, p < .001; and the absolute values of CW (.464) and WC (.604) were no longer significantly different, t(53) = 1.67, p > .05.; (...) The 40 % size change condition with extremal edges met both normalization criteria that we previously defined, with both CC and WW [t(53) = 0.61, p > .05] and CW and WC [t(53) = 1.67, p > .05] being symmetric (i.e., neither was significantly asymmetric).","With extremal edges, a reduced amount of boundary extension occurred for the 16 % condition, and only normalization was found for the 40 % condition.","Correct-frequentist"
