"","Article.ID","Statement.ID","Stat.ID","Journal.ID","Reference","Link","Type.of.statistics","t","N1","N2","p","Page.number","Associated.statistics","Negative.statement","Category"
"61",50,1,2,1,"Hale, R. G., Brown, J. M., McDunn, B. A., & Siddiqui, A. P. (2015). An influence of extremal edges on boundary extension. Psychonomic Bulletin & Review, 22(4), 961966.","http://link.springer.com/article/10.3758/s13423-014-0751-x","Paired Samples T-Test","1.67",54,NA,"0.057772","964","Finally, for the 40 % size change condition with extremal edges, CC (.341) was significantly less than zero, t(53) = 6.13, p < .001; WW (.289) was again significantly greater than zero, t(53) = 5.17, p < .001; and the absolute values of CW (.464) and WC (.604) were no longer significantly different, t(53) = 1.67, p > .05.; (...) The 40 % size change condition with extremal edges met both normalization criteria that we previously defined, with both CC and WW [t(53) = 0.61, p > .05] and CW and WC [t(53) = 1.67, p > .05] being symmetric (i.e., neither was significantly asymmetric).","With extremal edges, a reduced amount of boundary extension occurred for the 16 % condition, and only normalization was found for the 40 % condition.","Correct-frequentist"
"62",51,1,1,1,"Halvorson, K. M., & Hazeltine, E. (2015). Do small dual-task costs reflect ideomotor compatibility or the absence of crosstalk? Psychonomic Bulletin & Review, 22(5), 14031409. doi:10.3758/s13423-015-0813-8","http://link.springer.com/article/10.3758/s13423-015-0813-8","ANOVA",NA,NA,NA,NA,"1407","The intercept was not significant, F<1, indicating no significant dual-task costs across groups.","Nonetheless, reversed tasks were performed without costs even when paired with an unreversed task. This finding suggests that the separation of the central codes across tasks (e.g., Wickens, 1984) is more critical than the specific S-R relationships; dual-task costs can be avoided when the tasks engage distinct modality-based systems.","Incorrect-frequentist  whole population"
"63",52,1,1,2,"Hertel, P. T., & Hayes, J. A. (2015). Distracted by Cues for Suppressed Memories. Psychological Science, 26(6), 775783. http://doi.org/10.1177/0956797615570711
","http://pss.sagepub.com/content/26/6/775.abstract","Post-hoc T-Test",NA,NA,NA,"0.607","6","However, the distraction effect (baseline vs. suppression flankers) was significant in the direct-suppression condition, t(20)<U+2009>= <U+2009>3.03, p<U+2009>= .007, d = 1.08, confidence interval (CI) = [38.0, 205.5], and not in the substitution condition, t(20) = 0.52, p = .607, d = 0.16, CI = [-96.3, 57.7].","Responses to the targets were delayed when suppression cues (compared with baseline cues and new negative homographs) were used as flankers, but only following direct-suppression instructions and not when benign substitutes had been provided to aid suppression.[...]Finally, valence ratings of neutral targets were influenced by the valence of the flankers but not by the prior role of the negative flankers.","Incorrect-frequentist  current sample"
"64",53,1,1,1,"Hesslinger, V. M., Goldbach, L., & Carbon, C.-C. (2015). Men in red: A reexamination of the red-attractiveness effect. Psychonomic Bulletin & Review, 22(4), 11421148.","http://link.springer.com/article/10.3758/s13423-015-0866-8","Independent Samples T-Test","0.92",44,45,"0.36","1145","Participants in both color conditions gave comparable ratings of perceived attractiveness (condition red: M = 5.71, SD = 1.70; conditionwhite: M = 5.39, SD = 1.53) with the small difference between the average ratings not being statistically significant, t(87) = 0.92, p = 0.360, ns.","We did not find any significant impact of red in either of the studies.; Our results question the robustness and the ecological validity of Elliot et al.’s finding.","Correct-frequentist"
"65",53,1,2,1,"Hesslinger, V. M., Goldbach, L., & Carbon, C.-C. (2015). Men in red: A reexamination of the red-attractiveness effect. Psychonomic Bulletin & Review, 22(4), 11421148.","http://link.springer.com/article/10.3758/s13423-015-0866-8","Independent Samples T-Test","0.24",35,37,"0.81","1145","Again, there was no significant effect of color condition on perceived attractiveness, neither for the female (red: n = 35, M = 5.71, SD = 1.65; white: n = 37, M = 5.62, SD = 1.44) nor the male participants (red: n = 9, M = 5.70, SD = 2.02; white: n = 8, M = 4.33, SD = 1.59), t (70) = 0.24, p = 0.810, ns, and t(15) = 1.54, p = 0.144, ns, respectively.","We did not find any significant impact of red in either of the studies.; Our results question the robustness and the ecological validity of Elliot et al.’s finding.","Correct-frequentist"
"66",53,1,3,1,"Hesslinger, V. M., Goldbach, L., & Carbon, C.-C. (2015). Men in red: A reexamination of the red-attractiveness effect. Psychonomic Bulletin & Review, 22(4), 11421148.","http://link.springer.com/article/10.3758/s13423-015-0866-8","Independent Samples T-Test","1.54",9,8,"0.144","1145","Again, there was no significant effect of color condition on perceived attractiveness, neither for the female (red: n = 35, M = 5.71, SD = 1.65; white: n = 37, M = 5.62, SD = 1.44) nor the male participants (red: n = 9, M = 5.70, SD = 2.02; white: n = 8, M = 4.33, SD = 1.59), t (70) = 0.24, p = 0.810, ns, and t(15) = 1.54, p = 0.144, ns, respectively.","We did not find any significant impact of red in either of the studies.; Our results question the robustness and the ecological validity of Elliot et al.’s finding.","Correct-frequentist"
"67",54,1,1,3,"Hirst, W., Phelps, E. A., Meksin, R., Vaidya, C. J., Johnson, M. K., Mitchell, K. J., … Lustig, C. (2015). A ten-year follow-up of a study of memory for the attack of September 11, 2001: Flashbulb memories and memories for flashbulb events. Journal of Experimental Psychology: General, 144(3), 604.","http://psycnet.apa.org/journals/xge/144/3/604.pdf&productCode=pa&uid=2015-09755-001","Post-hoc T-Test/PC",NA,NA,NA,"0.06","611","In follow-up analyses, we found a significant difference between the total consistency scores for responses on Survey 2 and those reported on Survey 3, t(201) = 4.07, p<.001, d=0.33, confidence interval (CI) [.03, .09], but not between Survey 3 and Survey 4, t(201) = 1.92, p = .06, d = 0.16, Cl [-.07, .00].","There was rapid forgetting of both flashbulb and event memories within the first year, but the forgetting curves leveled off after that, not significantly changing even after a 10-year delay. /.../ The findings suggest that even traumatic memories and those implicated in a community’s collective identity may be inconsistent over time and these inconsistencies can persist without the corrective force of external influences.","Incorrect-frequentist  whole population"
"68",55,1,1,2,"Jirout, J. J., & Newcombe, N. S. (2015). Building Blocks for Developing Spatial Skills: Evidence From a Large, Representative U.S. Sample. Psychological Science, 26(3), 302310. http://doi.org/10.1177/0956797614563338
","http://pss.sagepub.com/content/26/3/302.abstract","ANCOVA",NA,NA,NA,NA,"305","We reran the ANCOVA with frequency of play with puzzles, blocks, and board games as the only independent variable in order to test the full-factorial model (i.e., including interaction terms with gender and SES), and we observed the same results, with no significant interactions (ps > .18).","Using a large, nationally representative sample from the standardization study of the Wechsler Preschool and Primary Scale of IntelligenceFourth Edition, and controlling for other cognitive abilities, we observed a specific relation between parent-reported frequency of spatial play and Block Design scores that was invariant across gender and SES.","Incorrect-frequentist  current sample"
"69",56,1,1,1,"Kaiser, D., Stein, T., & Peelen, M. V. (2015). Real-world spatial regularities affect visual working memory for objects. Psychonomic Bulletin & Review, 22(6), 17841790. doi:10.3758/s13423-015-0833-4","http://link.springer.com/article/10.3758/s13423-015-0833-4","Paired Samples T-Test","0.29",38,NA,"0.77","1787","For the inverted pairs, we observed no significant difference in sensitivity between the two pair configurations, t < 1.","This effect was specific to upright stimuli, indicating that it did not reflect low-level grouping, because low-level grouping would be expected to equally affect memory for upright and inverted displays. These results suggest that objects can be held in visual working memory more efficiently when they are positioned according to frequently experienced real-world regularities.","Incorrect-frequentist  whole population"
"70",57,1,1,2,"Kang, M.-S., & Choi, J. (2015). Retrieval-Induced Inhibition in Short-Term Memory. Psychological Science, 0956797615577358. https://doi.org/10.1177/0956797615577358","http://pss.sagepub.com/content/26/7/1014.abstract","ANOVA",NA,NA,NA,NA,"1021","However, direction bias did not change with retention interval at all, such that the main effect of retention interval was not significant, F(1, 13) = 0.968, p = .343, and retention interval did not interact significantly with any other factors, F(1, 13) < 0.902, p > .36.","This retrieval-induced motion repulsion could be explained neither by reduced cognitive resources for maintaining short-term memory nor by continued inhibition between short-term memory representations.","Correct-frequentist"
"71",57,1,2,2,"Kang, M.-S., & Choi, J. (2015). Retrieval-Induced Inhibition in Short-Term Memory. Psychological Science, 0956797615577358. https://doi.org/10.1177/0956797615577358
","http://pss.sagepub.com/content/early/2015/05/19/0956797615577358.abstract","ANOVA",NA,NA,NA,"0.343","1021","However, direction bias did not change with retention interval at all, such that the main effect of retention interval was not significant, F(1, 13) = 0.968, p = .343, and retention interval did not interact significantly with any other factors, F(1, 13) < 0.902, p > .36.","This retrieval-induced motion repulsion could be explained neither by reduced cognitive resources for maintaining short-term memory nor by continued inhibition between short-term memory representations.","Correct-frequentist"
"72",58,1,1,1,"Keane, B. P., Kastner, S., Paterno, D., & Silverstein, S. M. (2014). Is 20/20 vision good enough? Visual acuity differences within the normal range predict contour element detection and integration. Psychonomic Bulletin & Review, 22(1), 121127. https://doi.org/10.3758/s13423-014-0647-9
","http://link.springer.com/article/10.3758/s13423-014-0647-9","ANOVA",NA,NA,NA,"0.951","124","More importantly, the collinear facilitation effect was independent of VA [F(1,18) < 0.1, p = .951, <U+03B7>p2 < .001].","Moreover, although the two groups exhibited similar collinear facilitation, SharpPerceivers could detect the central target with lower contrast at high spatial frequencies (p <. 05).","Incorrect-frequentist  current sample"
"73",59,1,1,1,"Kelly, S., Healey, M., Özyürek, A., & Holler, J. (2014). The processing of speech, gesture, and action during language comprehension. Psychonomic Bulletin & Review, 22(2), 517523. https://doi.org/10.3758/s13423-014-0681-7
","http://link.springer.com/article/10.3758/s13423-014-0681-7","Planned Comparision T-Test",NA,NA,NA,NA,"521","Congruent gesturespeech stimuli produced fewer errors (M = 2.6%) than did incongruent stimuli (M = 4.8%), t1(61) = 5.38, p < .001; t2(57) = 3.56, p < .001, whereas in the action condition, no differences were visible between congruent and incongruent actionspeech stimuli, t1(61) = 1.34, n.s.; t2(57) = 0.73, n.s. Refer to Fig. 2.","For all subjects, stimuli in which the gestures and actions were incongruent with the speech produced more errors and longer response times than did stimuli that were congruent, but this effect was less prominent for speechaction stimuli than for speechgesture stimuli.","Incorrect-frequentist  current sample"
"74",60,1,1,1,"Kessler, Y., & Oberauer, K. (2015). Forward scanning in verbal working memory updating. Psychonomic Bulletin & Review, 22(6), 17701776. doi:10.3758/s13423-015-0853-0","http://link.springer.com/article/10.3758/s13423-015-0853-0","Bayesian analysis",NA,NA,NA,"0.46",NA,"When comparing the fits of the best-fitting models, compelling evidence was observed favoring the model fit to the reading-direction-recoded data, BF = 1.14 × 1035.","The SGS model fit the data only when the scanning direction was taken into account, establishing the role of item-based forward scanning during WM updating.","Bayesian-analysis"
"75",61,1,1,1,"Kidd, E., Tennant, E., & Nitschke, S. (2015). Shared abstract representation of linguistic structure in bilingual sentence comprehension. Psychonomic Bulletin & Review, 22(4), 10621067.","http://link.springer.com/article/10.3758/s13423-014-0775-2","Post-hoc T-Test/PC",NA,NA,NA,NA,"1065","Figure 2 shows that the proportion of object RC interpretations in the baseline condition and following English subject RC primes was similar (Mbaseline = .54, MSubRC = .56), but was higher following English object RC primes (MObjRC = .65).","The results showed that English object RCs primed significantly greater object RC interpretations in German in comparison to baseline and subject RC prime conditions, but that English subject RC primes did not change the participants’ baseline preferences.","Incorrect-frequentist  current sample"
"76",62,1,1,3,"Kogut, T., Slovic, P., & Västfjäll, D. (2015). Scope insensitivity in helping decisions: Is it a matter of culture and values? Journal of Experimental Psychology: General, 144(6), 10421052. doi:10.1037/a0039708","http://psycnet.apa.org/journals/xge/144/6/1042/","ANOVA",NA,NA,NA,"0.91","1045","As can be seen in Figure 1, simple effect tests revealed that the single victim received significantly higher contributions (M=.91, SD=.38) than the group of victims (M=.56, SD=.49) only for Western Israeli subjects (p=.004, effect size d=.80), but not for the Bedouins participants (single victims, M=.72, SD=.46; groups, M=.71, SD=.42; p=.91, effect size d=.04).","In the first study, the singularity effect was found only among Western Israelis and not among Bedouin participants (a more collectivist group).","Correct-frequentist"
"77",63,1,1,1,"Koop, G. J., Criss, A. H., & Malmberg, K. J. (2014). The role of mnemonic processes in pure-target and pure-foil recognition memory. Psychonomic Bulletin & Review, 22(2), 509516. https://doi.org/10.3758/s13423-014-0703-5
","http://link.springer.com/article/10.3758/s13423-014-0703-5","Independent Samples T-Test","0.26",36,36,"0.798","511","As is readily apparent in the first column of Table 1, neither the HR, t(76) = 0.19, p = .847, nor the FAR, t(70) = 0.26, p = .798, differed between pure and standard test lists for Experiment 1, indicating insensitivity to test composition without feedback.","When no feedback was provided, performance was nearly identical for standard and pure test lists, replicating previous findings. Only in the presence of accurate feedback were participants able to successfully adapt to pure list environments and improve their accuracy.","Incorrect-frequentist  current sample"
"78",63,1,2,1,"Koop, G. J., Criss, A. H., & Malmberg, K. J. (2014). The role of mnemonic processes in pure-target and pure-foil recognition memory. Psychonomic Bulletin & Review, 22(2), 509516. https://doi.org/10.3758/s13423-014-0703-5
","http://link.springer.com/article/10.3758/s13423-014-0703-5","Independent Samples T-Test","0.19",39,39,"0.847","511-512","As is readily apparent in the first column of Table 1, neither the HR, t(76) = 0.19, p = .847, nor the FAR, t(70) = 0.26, p = .798, differed between pure and standard test lists for Experiment 1, indicating insensitivity to test composition without feedback.","When no feedback was provided, performance was nearly identical for standard and pure test lists, replicating previous findings. Only in the presence of accurate feedback were participants able to successfully adapt to pure list environments and improve their accuracy.","Incorrect-frequentist  current sample"
"79",64,1,1,2,"Kret, M. E., Fischer, A. H., & Dreu, C. K. W. D. (2015). Pupil Mimicry Correlates With Trust in In-Group Partners With Dilating Pupils. Psychological Science, 26(9), 14011410. http://doi.org/10.1177/0956797615588306
","http://journals.sagepub.com/doi/abs/10.1177/0956797615588306","Correlation",NA,NA,NA,NA,"1407","We observed that constriction mimicry did not correlate with partner-pupil contingent distrust.","Results showed that (a) participants trusted partners with dilating pupils and withheld trust from partners with constricting pupils, (b) participants’ pupils mimicked changes in their partners’ pupils, and (c) dilation mimicry predicted trust in in-group partners, whereas constriction mimicry did not.","Correct-frequentist"
"80",65,1,1,3,"Kreuzbauer, R., King, D., & Basu, S. (2015). The mind in the object—Psychological valuation of materialized human expression. Journal of Experimental Psychology: General, 144(4), 764.","http://psycnet.apa.org/index.cfm?fa=buy.optionToBuy&id=2015-26264-001","Planned Comparision T-Test",NA,NA,NA,"0.24","772","Planned contrast tests showed that again, the differences within the aesthetic quality conditions were not statistically significant (p=.24). Finally, we performed a 2X2 ANOVA between the two accuracy and aesthetic conditions, but this interaction was not significant (p=.9), and there were also no significant main effects.","The studies showed that the proposed mechanism applies to symbolic, but not to functional or aesthetic material objects.","Incorrect-frequentist  whole population"
"81",65,2,1,3,"Kreuzbauer, R., King, D., & Basu, S. (2015). The mind in the object—Psychological valuation of materialized human expression. Journal of Experimental Psychology: General, 144(4), 764.","http://psycnet.apa.org/index.cfm?fa=buy.optionToBuy&id=2015-26264-001","Independent Samples T-Test","0.84",NA,NA,NA,"774","The question of whether participants felt that they could notice the difference between a designer- or algorithm-designed vase received a mean score of 1.57 (sd = .97) on a 9-point scale (1 = lowest) within both algorithm conditions, and the difference between the uniqueness and nonuniqueness condition was not significant (t = -0.84).","Furthermore, they show that this specific form of symbolic object valuation could not be explained by various other related psychological theories (e.g., uniqueness, scarcity, physical touching, creative performance).","Incorrect-frequentist  current sample"
"82",66,1,1,3,"Kumar, N., Manjaly, J. A., & Sunny, M. M. (2015). The relationship between action-effect monitoring and attention capture. Journal of Experimental Psychology: General, 144(1), 1823. https://doi.org/10.1037/xge0000032
","http://psycnet.apa.org/journals/xge/144/1/18/","ANOVA",NA,NA,NA,NA,"21","Results showed a significant main effect of Set Size, F(1, 13) = 591.92, p < .001, <U+03B7>p2 = 0.98, and Target, F(2, 26) = 11.94, p < .001. <U+03B7>p2 = 0.48, but not Action, F(1, 13) = 0.95, n.s., <U+03B7>p2 = 0.07.","Experiment 2 showed that the capture occurs only with predictable, but not with unpredictable, consequences of action.","Incorrect-frequentist  current sample"
"83",67,1,1,3,"Lähteenmäki, M., Hyönä, J., Koivisto, M., & Nummenmaa, L. (2015). Affective processing requires awareness. Journal of Experimental Psychology: General, 144(2), 339365. https://doi.org/10.1037/xge0000040
","http://psycnet.apa.org/journals/xge/144/2/339/","One Sample T-Test","0.47",18,NA,"0.645","344","In both tasks, performance was at chance level, ts(17)<.471, ps>.644, rs<.052, when participants reported no awareness of the stimuli, and ex­ceeded chance level when participants were partially or completely aware of the stimuli, all ts(17) > 4.853, ps < .001, rs > .500.","When participants reported no awareness of the stimuli, semantic and affective categorization were at chance level and priming scores did not differ from zero. When participants were even partially aware of the stimuli, (a) both semantic and affective categorization could be performed above chance level with equal accuracy, (b) semantic categorization was faster than affective categorization, and (c) both semantic and affective priming were observed.","Incorrect-frequentist  current sample"
"84",67,1,2,3,"Lähteenmäki, M., Hyönä, J., Koivisto, M., & Nummenmaa, L. (2015). Affective processing requires awareness. Journal of Experimental Psychology: General, 144(2), 339365. https://doi.org/10.1037/xge0000040
","http://psycnet.apa.org/journals/xge/144/2/339/","One Sample T-Test","0.452",18,NA,"0.657","344","In both tasks, performance was at chance level, ts(17)<.471, ps>.644, rs<.052, when participants reported no awareness of the stimuli, and ex­ceeded chance level when participants were partially or completely aware of the stimuli, all ts(17) > 4.853, ps < .001, rs > .500.","When participants reported no awareness of the stimuli, semantic and affective categorization were at chance level and priming scores did not differ from zero. When participants were even partially aware of the stimuli, (a) both semantic and affective categorization could be performed above chance level with equal accuracy, (b) semantic categorization was faster than affective categorization, and (c) both semantic and affective priming were observed.","Incorrect-frequentist  current sample"
"85",67,1,3,3,"Lähteenmäki, M., Hyönä, J., Koivisto, M., & Nummenmaa, L. (2015). Affective processing requires awareness. Journal of Experimental Psychology: General, 144(2), 339365. https://doi.org/10.1037/xge0000040
","http://psycnet.apa.org/journals/xge/144/2/339/","One Sample T-Test","1.34",16,NA,"0.2","347","One-sample t tests for discrimination accuracy at different levels of awareness indicated that, in both tasks, when participants reported no awareness of the target their performance was at chance level, ts(15)<1.341, ps>.199, rs<.166","When participants reported no awareness of the stimuli, semantic and affective categorization were at chance level and priming scores did not differ from zero. When participants were even partially aware of the stimuli, (a) both semantic and affective categorization could be performed above chance level with equal accuracy, (b) semantic categorization was faster than affective categorization, and (c) both semantic and affective priming were observed.","Incorrect-frequentist  current sample"
"86",67,1,4,3,"Lähteenmäki, M., Hyönä, J., Koivisto, M., & Nummenmaa, L. (2015). Affective processing requires awareness. Journal of Experimental Psychology: General, 144(2), 339365. https://doi.org/10.1037/xge0000040
","http://psycnet.apa.org/journals/xge/144/2/339/","One Sample T-Test","0",16,NA,"1","347","One-sample t tests for discrimination accuracy at different levels of awareness indicated that, in both tasks, when participants reported no awareness of the target their performance was at chance level, ts(15)<1.341, ps>.199, rs<.166","When participants reported no awareness of the stimuli, semantic and affective categorization were at chance level and priming scores did not differ from zero. When participants were even partially aware of the stimuli, (a) both semantic and affective categorization could be performed above chance level with equal accuracy, (b) semantic categorization was faster than affective categorization, and (c) both semantic and affective priming were observed.","Incorrect-frequentist  current sample"
"87",67,1,5,3,"Lähteenmäki, M., Hyönä, J., Koivisto, M., & Nummenmaa, L. (2015). Affective processing requires awareness. Journal of Experimental Psychology: General, 144(2), 339365. https://doi.org/10.1037/xge0000040
","http://psycnet.apa.org/journals/xge/144/2/339/","One Sample T-Test","0.959",16,NA,"0.353","349","When the participants had no awareness of the stimulus (Awareness Rating 1), their performance was at chance level in all blocks, all ts(15)<.959, ps>.353, rs<.119.","When participants reported no awareness of the stimuli, semantic and affective categorization were at chance level and priming scores did not differ from zero. When participants were even partially aware of the stimuli, (a) both semantic and affective categorization could be performed above chance level with equal accuracy, (b) semantic categorization was faster than affective categorization, and (c) both semantic and affective priming were observed.","Incorrect-frequentist  current sample"
"88",68,1,1,2,"Lamy, D., Alon, L., Carmel, T., & Shalev, N. (2015). The Role of Conscious Perception in Attentional Capture and Object-File Updating. Psychological Science, 26(1), 4857. http://doi.org/10.1177/0956797614556777
","http://pss.sagepub.com/content/26/1/48.abstract","ANOVA",NA,NA,NA,NA,"51","In contrast, when the cue was in the irrelevant color, it produced a significant same-location cost when it was consciously perceived (M = 33 ms, SE = 11.29 ms), F(1, 52) = 8.31, p < .006, Cohen’s d = 0.77, but not when it was invisible (M = 1 ms, SE = 9.82 ms), F < 1, Cohen’s d = 0.02.","When the cue matched the participant’s attentional set, it strongly captured attention whether it was subliminal or consciously perceived. In contrast, a nonmatching cue did not capture attention but instead produced a same-location cost, which was contingent on consciously perceiving the cue.","Incorrect-frequentist  current sample"
