"","Article.ID","Statement.ID","Stat.ID","Journal.ID","Reference","Link","Type.of.statistics","t","N1","N2","p","Page.number","Associated.statistics","Negative.statement","Category"
"1",1,1,1,1,"Ambron, E., & Foroni, F. (2015). The attraction of emotions: Irrelevant emotional information modulates motor actions. Psychonomic Bulletin & Review, 22(4), 11171123.","http://link.springer.com/article/10.3758/s13423-014-0779-y","One Sample T-Test","0.22",27,NA,"0.41","1120","The analysis confirmed that participants’ reaching paths veered significantly toward the distractor when this stimulus displayed emotional content [happy faces, t(26) =3.3, p < .005; angry faces, t(26) =2.1, p < .05], whereas the paths did not do so when the distractor displayed neutral expressions [noisy-neutral expression, t(26) =0.22, n.s.; neutral expression, t(26) =0.15, n.s.].","The results showed that reaching paths veered toward faces with emotional expressions, in particular happiness, but not toward neutral expressions. ; This reinforces the view of emotions as attention-capturing stimuli that are, however, also potential sources of distraction for motor actions.","Incorrect-frequentist  whole population"
"2",1,1,2,1,"Ambron, E., & Foroni, F. (2015). The attraction of emotions: Irrelevant emotional information modulates motor actions. Psychonomic Bulletin & Review, 22(4), 11171123.","http://link.springer.com/article/10.3758/s13423-014-0779-y","One Sample T-Test","0.15",27,NA,"0.44","1120","The analysis confirmed that participants’ reaching paths veered significantly toward the distractor when this stimulus displayed emotional content [happy faces, t(26) =3.3, p < .005; angry faces, t(26) =2.1, p < .05], whereas the paths did not do so when the distractor displayed neutral expressions [noisy-neutral expression, t(26) =0.22, n.s.; neutral expression, t(26) =0.15, n.s.].","The results showed that reaching paths veered toward faces with emotional expressions, in particular happiness, but not toward neutral expressions. ; This reinforces the view of emotions as attention-capturing stimuli that are, however, also potential sources of distraction for motor actions.","Incorrect-frequentist  whole population"
"3",2,1,1,1,"Anderson, B. A. (2015). Value-driven attentional priority is context specific. Psychonomic Bulletin & Review, 22(3), 750756.","http://link.springer.com/article/10.3758/s13423-014-0724-0","Planned Comparision T-Test",NA,NA,NA,"0.643","754","By contrast, a distractor had no influence on RTs when it appeared in the context within which it had never been rewarded, relative to distractor-absent trials, t(29) = 0.47, p = .643.","The results show that the same stimulus feature either does or does not capture attention, depending on whether it has been rewarded specifically in the context within which it appears.","Incorrect-frequentist  whole population"
"4",3,1,1,2,"Atir, S., Rosenzweig, E., & Dunning, D. (2015). When Knowledge Knows No Bounds: Self-Perceived Expertise Predicts Claims of Impossible Knowledge. Psychological Science, 26(8), 12951303. http://doi.org/10.1177/0956797615588195
","http://pss.sagepub.com/content/26/8/1295.abstract","T-Test for slopes",NA,NA,NA,NA,"6","Moreover, the effect of self-perceived knowledge did not interact with the warning condition, b = 0.005, t(260.89) = -0.52.","In Study 3, warning participants that some of the concepts they saw were fictitious did not reduce the relationship between self-perceived knowledge and overclaiming, which suggests that this relationship is not driven by impression management.","Incorrect-frequentist  whole population"
"5",4,1,1,1,"Aue, W. R., Criss, A. H., & Prince, M. A. (2015). Dynamic memory searches: Selective output interference for the memory of facts. Psychon Bulletin & Review, 22(6), 17981806. doi:10.3758/s13423-015-0840-5","http://link.springer.com/article/10.3758/s13423-015-0840-5","Bayesian analysis",NA,NA,NA,NA,NA,"Moreover, a zero value for slope is 4.2 times more likely for Test 1 than the alternative (BF01 = 4.21).","No OI (output interference) was observed during the first test, when participants presumably searched semantic memory to answer the general-knowledge questions.","Bayesian-analysis"
"6",5,1,1,1,"Augustinova, M., Silvert, L., Ferrand, L., Llorca, P. M., & Flaudias, V. (2014). Behavioral and electrophysiological investigation of semantic and response conflict in the Stroop task. Psychonomic Bulletin & Review, 22(2), 543549. https://doi.org/10.3758/s13423-014-0697-z
","http://link.springer.com/article/10.3758/s13423-014-0697-z","ANOVA",NA,NA,NA,NA,"545","Indeed, the simple main effect of coloring was significant only for standard-incongruent trials,F(1, 27) = 15.40, p = .001, <U+03B7>p2 = .36, but not for color-associated or color-neutral trials, both Fs < 0.22, p > .65, n.s.","Consistent with our past findings (e.g., Augustinova et al. in Psychonomic Bulletin & Review 17:827-833, 2010), SLC speeded up reaction times for standard-incongruent items only, indicating that SLC reduced the response conflict that these (but not color-associated and neutral) items involve.","Incorrect-frequentist  current sample"
"7",6,1,1,2,"Barker, J. E., & Munakata, Y. (2015). Time Isn’t of the Essence: Activating Goals Rather Than Imposing Delays Improves Inhibitory Control in Children. Psychological Science, 26(12), 18981908. http://doi.org/10.1177/0956797615604625","http://pss.sagepub.com/content/26/12/1898.abstract","Generalised Linear Mixed Model",NA,NA,NA,NA,"1904","In contrast to claims based on prior work, delays did not benefit response inhibition independently of task reminders. Children in the delay conditions performed no better than children in the no-delay conditions (p > .250)","Task reminders, but not adult-imposed delays, improved children’s response inhibition.","Incorrect-frequentist  current sample"
"8",7,1,1,3,"Basile, B. M., Schroeder, G. R., Brown, E. K., Templer, V. L., & Hampton, R. R. (2015). Evaluation of seven hypotheses for metamemory performance in rhesus monkeys. Journal of Experimental Psychology: General, 144(1), 85102. https://doi.org/10.1037/xge0000031
","http://psycnet.apa.org/journals/xge/144/1/85/","Post-hoc correlation",NA,NA,NA,"0.341","92","This was supported by our post hoc correlational analysis, which found that the change in choice to see the answer did not correlate with the change in accuracy, r(9)=.317, p=.341. Regardless, the fact that monkeys chose to see the answer more often when necessary suggests that they were not responding by rote.","We found no evidence to support the hypotheses of behavioral cue association, rote response learning, expectancy violation, response competition, generalized search strategy, or postural mediation. In contrast, we repeatedly found evidence to support the memory monitoring hypothesis","Correct-frequentist"
"9",8,1,1,1,"Beesley, T., Pearson, D., & Le Pelley, M. (2015). Implicit learning of gaze-contingent events. Psychonomic Bulletin & Review, 22(3), 800807.","http://link.springer.com/article/10.3758/s13423-014-0720-4","Independent Samples T-Test",NA,27,13,NA,"804","This mismatch cuing score (aware = 32 ms; unaware = 40 ms) did not differ between the two groups, t < 1.","Furthermore, there was no difference in the cuing score between those participants classified as aware or unaware of the contingencies on a subsequent forced-choice recognition task.","Incorrect-frequentist  current sample"
"10",9,1,1,2,"Benozio, A., & Diesendruck, G. (2015). From Effort to Value: Preschool Children’s Alternative to Effort Justification. Psychological Science, 26(9), 14231429. http://doi.org/10.1177/0956797615589585
","http://pss.sagepub.com/content/26/9/1423.abstract","Planned Comparision T-Test",NA,NA,NA,NA,"1426","Follow-up analyses on these two-way interactions revealed that when 4-year-olds distributed attractive stickers, effort did not affect their distribution rates (M = 20%, SD = 16.3%; M = 19.1%, SD = 10.8%, for the effortful and effortless conditions, respectively), but effort did affect 6-year-olds distribution rates, t(51) = 3.1, p = .001 (one-tailed), Cohen’s d = 0.87. As can be seen in Figure1a, 6-year-olds distributed 54% fewer stickers in the effortful condition (M = 9.6%, SD = 12.1%) than in the effortless condition (M = 20.7%, SD = 13.9%).
","Investing great effort to obtain attractive rewards (a consonant situation) led 6-year-olds, but not 4-year-olds, to enhance the value of the rewards and thus distribute fewer of them to others.","Incorrect-frequentist  current sample"
"11",10,1,1,1,"Ben-Shalom, A., & Ganel, T. (2014). Spatial resolution in visual memory. Psychonomic Bulletin & Review, 22(2), 500508. https://doi.org/10.3758/s13423-014-0707-1
","http://link.springer.com/article/10.3758/s13423-014-0707-1","ANOVA",NA,NA,NA,"0.226","503","However, unlike as in Experiment 1, JNDs did not differ between the short- and the long-delay conditions, and the main effect of delay period was not significant, F(1, 9) = 0.226.","When different objects were referred to, similar spatial resolution was found for the two delay periods, suggesting that initial processing stages are sensitive to object-based properties. Conversely, superior resolution was found for the short, as compared with the long, delay when features were referred to.","Incorrect-frequentist  whole population"
"12",11,1,1,2,"Biggs, A. T., Cain, M. S., & Mitroff, S. R. (2015). Cognitive Training Can Reduce Civilian Casualties in a Simulated Shooting Environment. Psychological Science, 26(8), 11641176. http://doi.org/10.1177/0956797615579274
","http://pss.sagepub.com/content/26/8/1164.abstract","Correlation",NA,NA,NA,"0.27","9","Two self-report scales were significantly related to the number of simulated civilian casualties at baseline: More simulated civilian casualties were related to higher ADHD scores, r(84) = .21, p < .05, and greater attentional impulsivity, r(82) = .24, p < .05. Simulated civilian casualties were not related to self-reported motor impulsivity, r(83) = .12, p = .27, nor the total number of shots fired in the simulated shooting task—a behavioral measure of motor impulsivity, r(86) = .08, p = .44.","Individual-difference measures demonstrated, perhaps counterintuitively, that simulated civilian casualties were not related to motor impulsivity (i.e., an itchy trigger finger) but rather to an individual’s cognitive ability to withhold an already initiated response (i.e., an itchy brain).
","Incorrect-frequentist  current sample"
"13",12,1,1,2,"Bodenmann, G., Meuwly, N., Germann, J., Nussbeck, F. W., Heinrichs, M., & Bradbury, T. N. (2015). Effects of Stress on the Social Support Provided by Men and Women in Intimate Relationships. Psychological Science, 26(10), 15841594. http://doi.org/10.1177/0956797615594616
","http://pss.sagepub.com/content/26/10/1584.abstract","Post-hoc T-Test",NA,NA,NA,"0.06","1590","http://pss.sagepub.com/content/26/10/1584/T2.large.jpg","While unstressed, men and women generally provided similar support to the stressed partner.","Incorrect-frequentist  current sample"
"14",13,1,1,1,"Borst, G., Ahr, E., Roell, M., & Houdé, O. (2014). The cost of blocking the mirror generalization process in reading: evidence for the role of inhibitory control in discriminating letters with lateral mirror-image counterparts. Psychonomic Bulletin & Review, 22(1), 228234. https://doi.org/10.3758/s13423-014-0663-9
","http://link.springer.com/article/10.3758/s13423-014-0663-9","Paired Samples T-Test",NA,24,NA,NA,"232","For the building group, the time required and the accuracy for determining that two buildings facing opposite direction were similar did not differ with respect to the prime: ts < 1.","In Experiment 1, participants required more time when determining that two animals (but not two buildings) were mirror images of each other when preceded by letters with mirror-image counterparts than without mirror-image counterparts (‘a/h’).","Incorrect-frequentist  current sample"
"15",13,2,1,1,"Borst, G., Ahr, E., Roell, M., & Houdé, O. (2014). The cost of blocking the mirror generalization process in reading: evidence for the role of inhibitory control in discriminating letters with lateral mirror-image counterparts. Psychonomic Bulletin & Review, 22(1), 228234. https://doi.org/10.3758/s13423-014-0663-9
","http://link.springer.com/article/10.3758/s13423-014-0663-9","Paired Samples T-Test","1.21",31,NA,"0.24","232","A 2 (type of letters prime: with vs. without mirror-image counterparts) × 2 (type of probe stimuli: animal vs. building) repeated measure ANOVA on the RTs revealed a significant two-way interaction between the type of letters presented on the prime and the type of probe stimuli: F(1, 30) = 7.99, p < 0.01, <U+03B7>p2 = 0.21, with longer RTs on the probe preceded by letters with mirror-image counterparts (e.g., ‘b/d’) than on the probes preceded by letters with no mirror-image counterparts (e.g., ‘f/t’) when animals were displayed on the probes, t(30) = 2.62, p < 0.01, d = 0.47, but not when buildings were presented on the probes, t(30) = 1.21, p = 0.24 (Table 2).","In Experiment 2, we replicated the results with different letters without mirror-image counterparts and with the type of probe stimuli (animal or building) manipulated as a within-subject factors.","Incorrect-frequentist  current sample"
"16",14,1,1,1,"Camos, V., & Portrat, S. (2015). The impact of cognitive load on delayed recall. Psychonomic Bulletin & Review, 22(4), 10291034.","http://link.springer.com/article/10.3758/s13423-014-0772-5","Bayesian analysis",NA,NA,NA,NA,NA,NA,"Conversely, the addition of concurrent articulation reduced immediate but not delayed recall. This study shows that both working and episodic memory traces depend on the cognitive load of the concurrent task, whereas the use of rehearsal affects only working memory performance.","Incorrect-frequentist  whole population"
"17",15,1,1,1,"Capozzi, F., Bayliss, A. P., Elena, M. R., & Becchio, C. (2015). One is not enough: Group size modulates social gaze-induced object desirability effects. Psychonomic Bulletin & Review, 22(3), 850855.","http://link.springer.com/article/10.3758/s13423-014-0717-z","ANOVA",NA,NA,NA,"0.116","853","Neither the effect of number of faces, F(1, 24) = 1.214, p = .282, <U+03B7>2 = .048, nor the cuing × number of faces interaction, F(1, 24) = 2.655, p = .116, <U+03B7>2 = .100, approached significance, suggesting that the single and the multiple faces produced similar amounts of attentional cuing (see Fig. 2).","While response time measures revealed equal gaze-cuing effects for both conditions, a boost in affective evaluation was observed only for objects looked at by several different faces.","Incorrect-frequentist  current sample"
"18",16,1,1,2,"Chen, J., Sperandio, I., & Goodale, M. A. (2015). Differences in the Effects of Crowding on Size Perception and Grip Scaling in Densely Cluttered 3-D Scenes. Psychological Science, 26(1), 5869. http://doi.org/10.1177/0956797614556776
","http://pss.sagepub.com/content/26/1/58.abstract","ANOVA",NA,NA,NA,"0.716","65","One-way repeated measures ANOVAs on the normalized Fisher Z scores revealed that although eccentricity had a highly significant effect on manual estimates, F(2, 22) = 13.01, p = .000, it had no effect on PGAs, F(2, 22) = 0.340, p = .716. This finding supports the idea that any influence of crowding on grip scaling is not affected by eccentricity.","Experiments 2 and 3, we found that changing the eccentricity of the display and the orientation of the flankers had no effect on grasping but strongly affected perception.","Incorrect-frequentist  current sample"
"19",17,1,1,2,"Chiu, Y.-C., & Egner, T. (2015). Inhibition-Induced Forgetting: When More Control Leads to Less Memory. Psychological Science, 26(1), 2738. http://doi.org/10.1177/0956797614553945
","http://pss.sagepub.com/content/26/1/27.abstract","Paired Samples T-Test","0.8750",53,NA,"0.3856","33","Note that d' did not differ between no stimuli (M = 0.81, 95% CI= [0.70, 0.92]) and yes stimuli (M = 0.87, 95% CI = [0.76, 0.98]), t(52) = 0.88, p > .1, Cohen’s d = 0.12 (Fig. 3).","Experiment 4 showed that this inhibition-induced forgetting was not attributable to event congruency.","Incorrect-frequentist  current sample"
"20",18,1,1,3,"Chua, K.-W., Richler, J. J., & Gauthier, I. (2015). Holistic processing from learned attention to parts. Journal of Experimental Psychology: General, 144(4), 723.","http://psycnet.apa.org/index.cfm?fa=buy.optionToBuy&id=2015-11174-001","ANOVA",NA,NA,NA,"0.73","726","With trained subjects only, the Condition x Congruency x Trial Type interaction was only marginally significant, F(1, 77)=3.06, p= .084, <U+03B7>p2= 2 .04, with significant holistic processing (Congruency x Trial Type interaction) for diagnostic composites, F(1, 77) =6.67, p =.01, etha squared=.08, but not for nondiagnostic composites, F(1, 77) =0.12, p =.73, etha squared= .002.","Exposure to Greeble parts resulted in general failures of selective attention for nondiagnostic composites, but face-like holistic processing was only observed for diagnostic composites.","Incorrect-frequentist  current sample"
"21",19,1,1,3,"Coman, A., & Hirst, W. (2015). Social identity and socially shared retrieval-induced forgetting: The effects of group membership. Journal of Experimental Psychology: General, 144(4), 717.","http://psycnet.apa.org/index.cfm?fa=buy.optionToBuy&id=2015-18938-001","Post-hoc T-Test",NA,NA,NA,"0.84","720","In the Princeton identity salience condition, we found that listening to a Princeton speaker resulted in an SSRIF effect, t(31)=2.73, p<.01, d=0.49, CI [0.21, 0.03], whereas listening to a Yale speaker did not, t(31)=0.20, p=.84, d=0.04, CI [0.11, 0.09] (see Figure 1, left panel).","In Experiment 1, Princeton students listening to a speaker selectively recall previously studied material showed SSRIF when the speaker was identified as a fellow Princeton student, but not when he or she was identified as a Yale student.","Incorrect-frequentist  current sample"
"22",20,1,1,3,"Darby, K. P., & Sloutsky, V. M. (2015). The cost of learning: Interference effects in memory development. Journal of Experimental Psychology: General, 144(2), 410431. https://doi.org/10.1037/xge0000051
","http://psycnet.apa.org/journals/xge/144/2/410/","Planned Comparision T-Test",NA,NA,NA,"0.48","416","Planned comparisons indicated that attenuation of accuracy was marginally significant in children for overlapping pairs, t(24) = 1.90, p = .07, Cohen’s d = 0.38, but not for unique pairs, p = .48.","Both age groups demonstrated interference effects, but only for repeated items.","Incorrect-frequentist  current sample"
"23",21,1,1,2,"Darby, K. P., & Sloutsky, V. M. (2015). When Delays Improve Memory: Stabilizing Memory in Children May Require Time. Psychological Science, 26(12), 19371946. http://doi.org/10.1177/0956797615607350","http://pss.sagepub.com/content/26/12/1937.abstract","Paired Samples T-Test","0.516",29,NA,"0.61","1943","Paired samples t tests indicated that savings were significant for unique pairs, t(28) = 3.00, p = .006, d = 1.19, but not for overlapping pairs, p = .61.","Results of Experiment 2 suggest that the benefit of this delay is limited to situations in which children are given enough information to form complex memory structures.","Incorrect-frequentist  whole population"
"24",22,1,1,2,"de Bruin, A., Treccani, B., & Della Sala, S. (2015). Cognitive advantage in bilingualism an example of publication bias? Psychological Science, 26(1), 99107.","http://pss.sagepub.com/content/26/1/99.abstract","Independent Samples T-Test","0.6",66,38,"0.554","5","Using independent-samples t tests, we found no significant differences between abstracts that supported the bilingual advantage and those that challenged it in terms of year of conference presentation and number of participants per group (see Table 3).","Studies with results fully supporting the bilingual-advantage theory were most likely to be published, followed by studies with mixed results. Studies challenging the bilingual advantage were published the least.This discrepancy was not due to differences in sample size, tests used, or statistical power.","Incorrect-frequentist  current sample"
"25",23,1,1,2,"Dearing, E., Zachrisson, H. D., & Narde, A. (2015). Age of Entry Into Early Childhood Education and Care as a Predictor of Aggression Faint and Fading Associations for Young Norwegian Children. Psychological Science, 26(10), 15951607.","http://pss.sagepub.com/content/26/10/1595.abstract","Regression",NA,NA,NA,NA,"1603","Table 2.
Random-Effects Regression Estimates From the Covariate-Adjusted and Propensity-Score-Weighted Models Assessing Associations Between Age of Entry Into Early Childhood Education and Care (ECEC) and Teacher-Rated Aggression From 2 to 4 Years of Age","We found some evidence that age of entry into ECEC predicted aggression at age 2, albeit modestly and not robustly. Between the ages of 2 and 4 years, the effect of age of entry on aggression faded to negligible levels.","Incorrect-frequentist  current sample"
"26",24,1,1,1,"Deffler, S. A., Brown, A. S., & Marsh, E. J. (2015). Judging the familiarity of strangers: does the context matter? Psychonomic Bulletin & Review, 22(4), 10411047.","http://link.springer.com/article/10.3758/s13423-014-0769-0","Post-hoc T-Test",NA,NA,NA,"0.256","1045","As compared to novel backgrounds, landmarks increased the perceived familiarity of novel faces only when the face was rated as fitting with the place (a “yes” answer), t(26) = 2.81, p = .009, <U+03B7>2 = .232, but not when the face and place were not integrated (a “no” answer), t(26) = 1.16, p = .256, <U+03B7>2 = .024.","This effect only disappeared when participants failed to integrate the face with the place, judging that the two did not fit together. ; Our findings suggest that familiarity is not judged in isolation; rather, people are unable to completely disentangle the familiarity of the individual components of a scene.","Incorrect-frequentist  whole population"
"27",25,1,1,2,"DeLoss, D. J., Watanabe, T., & Andersen, G. J. (2015). Improving Vision Among Older Adults: Behavioral Training to Improve Sight. Psychological Science, 26(4), 456466. http://doi.org/10.1177/0956797614567510
","http://pss.sagepub.com/content/26/4/456.abstract","Post-hoc T-Test",NA,NA,NA,"0.398","462","Older individuals showed a significant improvement in near acuity, t(12) = 2.217, pFDR = .047, d = 0.615, whereas no significant change in near acuity was found in younger individuals, t(13) = 0.265, pFDR = .398, d = 0.071 (Fig. 6). Similarly, older individuals showed no significant change in far acuity, t(12) = 0.503, pFDR = .398, d = 0.140, whereas a significant improvement in far acuity was found for younger individuals, t(13) = 2.592, pFDR = .044, d = 0.693 (Fig. 7).","Older adults performed as well after training as did college-age younger adults prior to training.","Incorrect-frequentist  current sample"
"28",26,1,1,2,"Dieguez, S., Wagner-Egger, P., & Gauvrit, N. (2015). Nothing Happens by Accident, or Does It? A Low Prior for Randomness Does Not Explain Belief in Conspiracy Theories. Psychological Science, 26(11), 17621770. http://doi.org/10.1177/0956797615598740
","http://pss.sagepub.com/content/26/11/1762.abstract","Correlation",NA,NA,NA,NA,"4","However, subjective randomness was not significantly correlated with any measures of belief in conspiracy theory.","In three studies, we investigated this hypothesis and failed to find the predicted association between low prior for randomness and conspiracist ideation, even when randomness was explicitly opposed to malevolent human intervention. Conspiracy believers’ and nonbelievers’ perceptions of randomness were not only indistinguishable from each other but also accurate compared with the normative view arising from the algorithmic information framework. Thus, the motto “nothing happens by accident,” taken at face value, does not explain belief in conspiracy theories.","Incorrect-frequentist  whole population"
"29",27,1,1,3,"Drouin, H., & Davidson, P. S. R. (2015). Any effects of social orientation priming on object-location memory are smaller than initially reported. Journal of Experimental Psychology: General, 144(6), e107e115. doi:10.1037/xge0000102","http://psycnet.apa.org/journals/xge/144/6/e107/","ANOVA",NA,NA,NA,"0.819","e111","A 2x2 ANOVA testing the effects of gender and priming on object-location memory showed no significant main effects (priming condition: F[1,86]=.053, p=.819, eta¡2=.001; gender: F[1,86]=1.58, p=.212, eta¡2=.018) and no significant interaction, F(1, 86)=.086, p=.769, eta¡2=.001.","In Experiment 2 (n = 90), we included gender as a formal factor and doubled the “dosage” of the priming, yet did not see any priming effects on memory.","Correct-frequentist"
"30",27,2,1,3,"Drouin, H., & Davidson, P. S. R. (2015). Any effects of social orientation priming on object-location memory are smaller than initially reported. Journal of Experimental Psychology: General, 144(6), e107e115. doi:10.1037/xge0000102","http://psycnet.apa.org/journals/xge/144/6/e107/","Independent Samples T-Test","0.5",50,51,"0.616","e111","A t test for independent samples on object-location memory showed no significant effect of priming, t(99)=.50, p=.616, d=.12.","In Experiment 3 (n = 101), we octupled the priming “dosage” and again saw no significant effects on memory.","Correct-frequentist"
